Venue,Venue
Proceedings of the International Conference on Recent Advances in Natural Language Processing (RANLP 2021),2
Conference of the European Chapter of the Association for Computational Linguistics: Main Volume,1
"Conference of the {E}uropean Chapter of the Association for Computational Linguistics: Volume 2, Short Papers",1
Findings of the Association for Computational Linguistics: EMNLP 2021,1
International Conference on Natural Language Generation,1
Proceedings of the The 19th Annual Workshop of the Australasian Language Technology Association,1
